{"meta":{"version":"0.1-draft","built":"2026-10-19","target_season":"Kharif 2027","decision_date":"2027-05-31","mock":true,"sources":[{"id":"MOCK","name":"Placeholder values for UI development","downloaded":"2026-10-19","coverage":"none: not real data"}]},"units":{"kalaburagi_yadgir":["Kalaburagi","Yadgir"],"ballari_vijayanagara":["Ballari","Vijayanagara"],"raichur":["Raichur"],"koppal":["Koppal"],"bidar":["Bidar"]},"crops":{"tur":{"name":"Tur (red gram)","harvest_window":["Dec","Jan","Feb"],"window_label":"Assumption","sowing_window_end":"mid-August","occupies_rabi":true},"maize":{"name":"Maize","harvest_window":["Oct","Nov"],"window_label":"Assumption","sowing_window_end":"to confirm","occupies_rabi":false},"soybean":{"name":"Soybean","harvest_window":["Oct","Nov"],"window_label":"Assumption","sowing_window_end":"mid-July","occupies_rabi":false},"cotton":{"name":"Cotton (kapas)","harvest_window":["Nov","Dec","Jan"],"window_label":"Assumption","sowing_window_end":"mid-August","occupies_rabi":true}},"weather":{"kalaburagi_yadgir":{"seasons":[1991,1992,1993,1994,1995,1996,1997,1998,1999,2000,2001,2002,2003,2004,2005,2006,2007,2008,2009,2010,2011,2012,2013,2014,2015,2016,2017,2018,2019,2020,2021,2022,2023,2024,2025],"jas_rain_mm":[235.73,342.36,605.86,493.94,420.68,494.98,589.72,532.25,503.57,412.76,455.47,439.15,498.83,568.24,461.48,446.53,635.62,583.86,534.53,498.65,338.74,455.89,397.5,724.95,265.87,393.09,495.65,546.68,519.71,519.83,468.61,264.43,440.65,671.46,508.51],"label":"Data"},"ballari_vijayanagara":{"seasons":[1991,1992,1993,1994,1995,1996,1997,1998,1999,2000,2001,2002,2003,2004,2005,2006,2007,2008,2009,2010,2011,2012,2013,2014,2015,2016,2017,2018,2019,2020,2021,2022,2023,2024,2025],"jas_rain_mm":[629.98,519.8,582.07,474.04,375.3,426.06,538.21,529.11,560.06,274.16,863.92,438.14,467.21,347.14,409.28,641.51,477.48,507.22,420.98,455.06,665.19,396.31,319.52,258.24,347.39,486.15,788.64,621.01,477.19,662.93,471.19,669.65,625.87,454.65,713.46],"label":"Data"},"raichur":{"seasons":[1991,1992,1993,1994,1995,1996,1997,1998,1999,2000,2001,2002,2003,2004,2005,2006,2007,2008,2009,2010,2011,2012,2013,2014,2015,2016,2017,2018,2019,2020,2021,2022,2023,2024,2025],"jas_rain_mm":[566.19,413.65,506.67,697.88,516.06,735.4,445.5,669.34,724.32,255.53,498.48,449.3,669.4,469.09,420.69,568.34,678.43,456.64,508.97,641.2,631.29,570.14,694.37,682.08,844.55,516.8,566.43,770.91,580.35,755.64,649.55,359.39,603.87,514.86,369.58],"label":"Data"},"koppal":{"seasons":[1991,1992,1993,1994,1995,1996,1997,1998,1999,2000,2001,2002,2003,2004,2005,2006,2007,2008,2009,2010,2011,2012,2013,2014,2015,2016,2017,2018,2019,2020,2021,2022,2023,2024,2025],"jas_rain_mm":[557.71,666.66,536.44,465.99,459.0,444.74,422.13,520.2,493.83,578.98,550.29,798.27,495.16,655.99,546.48,408.06,326.34,495.26,481.23,657.08,431.92,427.69,448.73,202.16,459.01,487.98,764.37,405.51,565.49,439.99,540.42,357.86,467.95,356.86,752.93],"label":"Data"},"bidar":{"seasons":[1991,1992,1993,1994,1995,1996,1997,1998,1999,2000,2001,2002,2003,2004,2005,2006,2007,2008,2009,2010,2011,2012,2013,2014,2015,2016,2017,2018,2019,2020,2021,2022,2023,2024,2025],"jas_rain_mm":[480.92,473.61,677.37,547.73,558.86,630.71,625.78,637.36,547.45,428.21,706.8,507.73,660.81,573.38,656.63,654.31,512.72,552.26,640.01,625.25,626.36,423.68,649.14,439.53,703.9,568.47,341.22,606.73,447.56,705.69,457.56,472.09,413.59,633.16,478.28],"label":"Data"}},"sufficiency":{"kalaburagi_yadgir|tur":{"seasons_ok":18,"passes":true},"ballari_vijayanagara|tur":{"seasons_ok":18,"passes":true},"raichur|tur":{"seasons_ok":18,"passes":true},"koppal|tur":{"seasons_ok":18,"passes":true},"bidar|tur":{"seasons_ok":18,"passes":true},"kalaburagi_yadgir|maize":{"seasons_ok":18,"passes":true},"ballari_vijayanagara|maize":{"seasons_ok":18,"passes":true},"raichur|maize":{"seasons_ok":18,"passes":true},"koppal|maize":{"seasons_ok":18,"passes":true},"bidar|maize":{"seasons_ok":18,"passes":true},"kalaburagi_yadgir|soybean":{"seasons_ok":18,"passes":true},"ballari_vijayanagara|soybean":{"seasons_ok":18,"passes":true},"raichur|soybean":{"seasons_ok":18,"passes":true},"koppal|soybean":{"seasons_ok":6,"passes":false},"bidar|soybean":{"seasons_ok":18,"passes":true},"kalaburagi_yadgir|cotton":{"seasons_ok":18,"passes":true},"ballari_vijayanagara|cotton":{"seasons_ok":18,"passes":true},"raichur|cotton":{"seasons_ok":18,"passes":true},"koppal|cotton":{"seasons_ok":18,"passes":true},"bidar|cotton":{"seasons_ok":18,"passes":true}},"yield_draws":{"kalaburagi_yadgir|tur":{"weather_seasons":[1991,1992,1993,1994,1995,1996,1997,1998,1999,2000,2001,2002,2003,2004,2005,2006,2007,2008,2009,2010,2011,2012,2013,2014,2015,2016,2017,2018,2019,2020,2021,2022,2023,2024,2025],"q_per_acre":[5.21,5.27,3.64,3.72,3.93,5.56,4.65,5.74,3.49,5.09,3.86,6.13,4.01,3.7,5.04,3.27,3.69,5.63,6.08,3.69,3.27,4.46,4.22,4.13,3.83,3.14,5.75,4.21,5.03,5.02,3.78,3.13,4.08,4.63,5.81],"rel_errors":[0.08,0.28,0.16,-0.02,-0.06,-0.14,0.19,0.04,-0.0,0.19,-0.05,0.24,0.15,-0.14],"five_season_mean_q_per_acre":4.25,"data_through":"2023-24","model":"ridge","label":"Prediction"},"ballari_vijayanagara|tur":{"weather_seasons":[1991,1992,1993,1994,1995,1996,1997,1998,1999,2000,2001,2002,2003,2004,2005,2006,2007,2008,2009,2010,2011,2012,2013,2014,2015,2016,2017,2018,2019,2020,2021,2022,2023,2024,2025],"q_per_acre":[2.03,3.73,2.52,4.33,2.89,3.11,3.16,3.16,4.7,3.02,2.85,3.67,3.66,4.62,4.16,3.5,3.85,3.8,4.37,4.14,1.89,4.73,4.91,4.16,4.24,5.16,4.23,2.47,4.8,4.67,4.13,3.89,4.07,3.28,3.5],"rel_errors":[-0.08,-0.35,0.09,0.02,0.18,0.12,-0.12,-0.03,0.08,0.08,0.22,0.02,0.17,-0.06],"five_season_mean_q_per_acre":3.9,"data_through":"2023-24","model":"ridge","label":"Prediction"},"raichur|tur":{"weather_seasons":[1991,1992,1993,1994,1995,1996,1997,1998,1999,2000,2001,2002,2003,2004,2005,2006,2007,2008,2009,2010,2011,2012,2013,2014,2015,2016,2017,2018,2019,2020,2021,2022,2023,2024,2025],"q_per_acre":[5.15,6.39,4.7,7.57,6.26,3.83,5.45,3.91,3.28,4.25,5.12,5.14,3.62,4.54,4.24,6.97,4.07,3.83,5.0,5.66,4.45,3.28,3.66,5.44,4.43,4.55,3.81,3.93,3.43,4.76,5.46,5.82,4.57,3.76,4.05],"rel_errors":[-0.03,0.02,-0.02,-0.37,-0.13,-0.19,-0.22,0.07,0.13,-0.05,-0.32,-0.18,-0.3,-0.12],"five_season_mean_q_per_acre":4.54,"data_through":"2023-24","model":"ridge","label":"Prediction"},"koppal|tur":{"weather_seasons":[1991,1992,1993,1994,1995,1996,1997,1998,1999,2000,2001,2002,2003,2004,2005,2006,2007,2008,2009,2010,2011,2012,2013,2014,2015,2016,2017,2018,2019,2020,2021,2022,2023,2024,2025],"q_per_acre":[4.27,3.83,4.75,2.88,3.92,1.84,3.73,3.98,3.56,3.26,4.84,3.17,3.58,2.2,4.24,4.47,3.93,4.0,2.98,3.96,4.44,4.66,2.52,3.3,3.8,3.17,5.01,2.63,4.94,3.46,4.13,3.43,4.52,4.05,3.84],"rel_errors":[0.12,0.33,0.09,-0.07,-0.21,-0.26,-0.24,-0.13,-0.06,-0.07,0.13,0.07,-0.21,-0.17],"five_season_mean_q_per_acre":3.66,"data_through":"2023-24","model":"ridge","label":"Prediction"},"bidar|tur":{"weather_seasons":[1991,1992,1993,1994,1995,1996,1997,1998,1999,2000,2001,2002,2003,2004,2005,2006,2007,2008,2009,2010,2011,2012,2013,2014,2015,2016,2017,2018,2019,2020,2021,2022,2023,2024,2025],"q_per_acre":[4.14,3.18,4.99,4.99,3.85,5.53,4.55,4.62,5.24,4.29,4.89,4.82,3.17,2.66,3.39,4.34,6.82,6.59,5.48,2.56,5.22,3.35,4.22,3.5,4.04,5.87,3.51,3.75,6.83,3.21,4.29,5.52,4.11,4.86,3.9],"rel_errors":[-0.25,0.11,-0.06,-0.03,-0.17,-0.04,-0.26,-0.21,-0.04,0.03,0.15,0.4,-0.25,-0.03],"five_season_mean_q_per_acre":4.31,"data_through":"2023-24","model":"ridge","label":"Prediction"},"kalaburagi_yadgir|maize":{"weather_seasons":[1991,1992,1993,1994,1995,1996,1997,1998,1999,2000,2001,2002,2003,2004,2005,2006,2007,2008,2009,2010,2011,2012,2013,2014,2015,2016,2017,2018,2019,2020,2021,2022,2023,2024,2025],"q_per_acre":[3.08,13.95,12.38,17.87,12.67,7.75,11.83,10.48,17.91,11.36,14.41,14.08,13.81,13.51,13.11,14.6,11.27,8.66,8.83,13.78,12.82,7.51,11.43,13.1,13.44,3.1,11.65,11.02,13.16,17.63,8.88,12.07,9.88,14.97,13.44],"rel_errors":[-0.26,0.21,0.12,0.01,-0.05,-0.12,0.09,0.15,0.02,0.15,-0.16,0.1,0.09,-0.01],"five_season_mean_q_per_acre":12.11,"data_through":"2023-24","model":"baseline_b1","label":"Prediction"},"ballari_vijayanagara|maize":{"weather_seasons":[1991,1992,1993,1994,1995,1996,1997,1998,1999,2000,2001,2002,2003,2004,2005,2006,2007,2008,2009,2010,2011,2012,2013,2014,2015,2016,2017,2018,2019,2020,2021,2022,2023,2024,2025],"q_per_acre":[8.36,11.9,9.3,10.19,12.83,7.42,11.14,7.87,12.34,12.94,10.32,4.99,11.44,15.15,10.21,10.02,7.83,15.8,12.45,8.86,10.77,9.19,10.13,14.24,14.76,13.81,11.71,14.52,13.85,10.38,8.01,13.16,11.1,8.2,13.76],"rel_errors":[-0.21,-0.09,-0.04,-0.04,0.01,0.1,-0.1,0.05,0.06,-0.06,-0.1,-0.11,0.1,-0.08],"five_season_mean_q_per_acre":11.13,"data_through":"2023-24","model":"baseline_b1","label":"Prediction"},"raichur|maize":{"weather_seasons":[1991,1992,1993,1994,1995,1996,1997,1998,1999,2000,2001,2002,2003,2004,2005,2006,2007,2008,2009,2010,2011,2012,2013,2014,2015,2016,2017,2018,2019,2020,2021,2022,2023,2024,2025],"q_per_acre":[16.55,10.91,14.3,11.36,14.78,13.24,11.1,7.85,13.76,21.11,16.96,16.45,15.13,18.21,14.07,15.27,11.52,15.54,9.55,6.1,10.84,11.79,15.8,20.11,10.25,15.51,11.95,13.71,12.25,11.66,16.67,11.89,11.86,14.28,12.92],"rel_errors":[-0.03,-0.07,0.26,-0.03,0.17,0.16,-0.07,-0.14,0.26,-0.03,-0.08,-0.14,-0.12,-0.05],"five_season_mean_q_per_acre":13.19,"data_through":"2023-24","model":"baseline_b1","label":"Prediction"},"koppal|maize":{"weather_seasons":[1991,1992,1993,1994,1995,1996,1997,1998,1999,2000,2001,2002,2003,2004,2005,2006,2007,2008,2009,2010,2011,2012,2013,2014,2015,2016,2017,2018,2019,2020,2021,2022,2023,2024,2025],"q_per_acre":[11.43,10.12,10.98,8.15,12.17,12.63,8.38,16.03,13.2,7.63,12.61,12.86,18.09,13.92,11.73,12.7,10.16,14.98,11.28,13.85,16.79,9.94,11.47,11.54,10.31,13.22,15.46,12.01,12.41,8.44,11.46,11.71,12.46,11.18,9.5],"rel_errors":[0.17,0.12,-0.23,0.03,-0.29,-0.25,0.3,-0.16,-0.13,-0.01,-0.19,-0.02,0.12,0.19],"five_season_mean_q_per_acre":11.37,"data_through":"2023-24","model":"baseline_b1","label":"Prediction"},"bidar|maize":{"weather_seasons":[1991,1992